{
  "$schema": "https://json-schema.org/draft/2020-12/schema",
  "title": "registry_entry",
  "description": "One entry of research/registry.json (Implementation Decisions 10): a skill or a role the librarian may assign, from either scope. The registry is regenerated by `wayline registry build` and at every planner launch, so an entry is never edited by hand: `capability_summary`, `applicability_tags`, `cost_hint`, and `fixtures` come from the artifact's `wayline.json` sidecar, `sha256` is recomputed from the artifact's files, and `outcome` is computed from the journal's `ticket_launched` and `ticket_done` or `ticket_failed` pairs.",
  "type": "object",
  "required": ["id", "kind", "scope_kind", "path", "sha256", "capability_summary", "applicability_tags", "cost_hint", "fixtures", "outcome", "assignable"],
  "additionalProperties": false,
  "properties": {
    "id": {"type": "string", "pattern": "^[a-z0-9][a-z0-9-]*$", "description": "the skill's or role's name, which is also its directory name"},
    "kind": {"type": "string", "enum": ["skill", "role"]},
    "scope_kind": {"type": "string", "enum": ["global", "local"], "description": "global is the harness repository, local is the project's .claude/"},
    "path": {"type": "string", "pattern": "\\S", "description": "the artifact's directory, relative to the scope root it was found under"},
    "sha256": {"type": "string", "pattern": "^[0-9a-f]{64}$", "description": "recomputed over every file of the artifact's directory except the sidecar, so an edited skill is a changed entry"},
    "capability_summary": {"type": "string", "pattern": "\\S"},
    "applicability_tags": {
      "type": "object",
      "required": ["kinds", "data_types", "libraries", "venues"],
      "additionalProperties": false,
      "properties": {
        "kinds": {"type": "array", "items": {"type": "string", "enum": ["dossier", "lit", "code", "docs", "experiment", "analysis", "figure", "writing", "review", "decision", "harness"]}, "description": "the ticket kinds this artifact is for; an empty list means the librarian never assigns it by kind, which is what the interactive phase skills carry"},
        "data_types": {"type": "array", "items": {"type": "string", "pattern": "\\S"}},
        "libraries": {"type": "array", "items": {"type": "string", "pattern": "\\S"}},
        "venues": {"type": "array", "items": {"type": "string", "pattern": "\\S"}}
      }
    },
    "cost_hint": {"type": "string", "enum": ["small", "medium", "large"]},
    "fixtures": {"type": "array", "items": {"type": "string", "pattern": "^(prompt|role|skill|verifier|conductor)/[a-z0-9][a-z0-9-]*$"}, "description": "fixture ids in the Implementation Decisions 12 layout, `<kind>/<slug>`"},
    "outcome": {
      "type": "object",
      "required": ["assigned", "passed_first_time", "failed", "last_used"],
      "additionalProperties": false,
      "properties": {
        "assigned": {"type": "integer", "minimum": 0, "description": "launches this artifact was named in"},
        "passed_first_time": {"type": "integer", "minimum": 0, "description": "tickets that reached done on the attempt this artifact was first named in"},
        "failed": {"type": "integer", "minimum": 0},
        "last_used": {"type": ["string", "null"], "description": "the ts of the most recent launch naming it"}
      }
    },
    "assignable": {"type": "boolean", "description": "false for a local model-authored skill with no passing fixture, and for an artifact whose sidecar or files the build could not read"},
    "problems": {"type": "array", "items": {"type": "string", "pattern": "\\S"}, "description": "why the build set assignable false, or what the structural pre-check reported"}
  }
}
