{
  "id": "wayline-intake",
  "kind": "skill",
  "scope_kind": "global",
  "path": "skills/wayline-intake",
  "sha256": "0a1b2c3d4e5f60718293a4b5c6d7e8f90a1b2c3d4e5f60718293a4b5c6d7e8f9",
  "capability_summary": "Takes whatever the owner has and writes INTAKE.md and, when a quantitative goal is stated, GOAL.json.",
  "applicability_tags": {"kinds": [], "data_types": [], "libraries": [], "venues": []},
  "cost_hint": "medium",
  "fixtures": ["skill/wayline-intake"],
  "outcome": {"assigned": 0, "passed_first_time": 0, "failed": 0, "last_used": null},
  "assignable": true
}
